{
  "formatVersion": 1,
  "id": "story-inkscape",
  "title": "Story / Reel 9:16 (Inkscape)",
  "description": "Leinwand 1080 × 1920 px mit Hilfslinien und gesperrter Ebene für die Sicherheitszonen (vor dem Export ausblenden).",
  "target": "program",
  "programId": "inkscape",
  "format": {
    "label": "1080 × 1920",
    "widthPx": 1080,
    "heightPx": 1920,
    "dpi": null,
    "widthMm": null,
    "heightMm": null
  },
  "folder": "Social",
  "fileExtension": ".svg",
  "file": "files/story.svg",
  "printProfileId": null,
  "preview": "preview.png",
  "requiresSetup": false,
  "tags": [
    "social",
    "story",
    "inkscape"
  ]
}
