{
  "formatVersion": 1,
  "id": "hoodie-front-krita",
  "title": "Hoodie vorne (Krita)",
  "description": "Leinwand 330 × 280 mm (3898 × 3307 px, 300 dpi), transparent; Hilfslinien für Mitte, ideale Breite 300 mm und Richtwert der sicheren Fläche 280 × 240 mm.",
  "target": "program",
  "programId": "krita",
  "format": {
    "label": "330 × 280 mm",
    "widthPx": 3898,
    "heightPx": 3307,
    "dpi": 300,
    "widthMm": 330,
    "heightMm": 280
  },
  "folder": "Motive",
  "fileExtension": ".kra",
  "file": "files/hoodie-front.kra",
  "printProfileId": "shirtigo-hoodie-front",
  "preview": "preview.png",
  "requiresSetup": false,
  "tags": [
    "hoodie",
    "druck",
    "vorne",
    "krita"
  ],
  "assumptions": [
    "Lage der sicheren Fläche 280 × 240 mm (oben mittig) ist eine Annahme bis zum Testdruck."
  ]
}
