{
  "formatVersion": 1,
  "id": "post-krita",
  "title": "Post 4:5 (Krita)",
  "description": "Leinwand 1080 × 1350 px mit Hilfslinien und gesperrter Ebene für die Sicherheitszonen (vor dem Export ausblenden).",
  "target": "program",
  "programId": "krita",
  "format": {
    "label": "1080 × 1350",
    "widthPx": 1080,
    "heightPx": 1350,
    "dpi": null,
    "widthMm": null,
    "heightMm": null
  },
  "folder": "Social",
  "fileExtension": ".kra",
  "file": "files/post.kra",
  "printProfileId": null,
  "preview": "preview.png",
  "requiresSetup": false,
  "tags": [
    "social",
    "post",
    "krita"
  ]
}
